{
  "$schema": "../../analytic.schema.json",
  "info": {
    "version": "1.0.0",
    "timestamp": "2020-01-01T00:00:00Z",
    "checksum": "010203040506070809000A0B0C0D0E0F"
  },
  "sources": {
    "e4": "datasource.sample.json"
  },
  "fields": {
    "t": "#/sources/e4/fields/t",
    "hr": {
      "name": "heart rate",
      "description": "heart rate in bpm",
      "dtype": "float"
    }
  },
  "inputs": {
    "ibi": "#/sources/e4/streams/ibi",
    "bvp": "#/sources/e4/streams/bvp"
  },
  "streams": {
    "hr": {
      "name": "heart rate",
      "description": "heart rate calculated using IBI and BVP sensory data",
      "unit": "bpm",
      "frequency": 0,
      "index": "#/fields/t",
      "channels": [
        "#/fields/hr"
      ]
    }
  }
}